{
  "schema_version": "0.1",
  "dataset_name": "pet_airlines",
  "license": "CC-BY 4.0",
  "disclaimer": "Reference only. Always verify with official sources before travel.",
  "last_generated_at": "2026-04-28T00:00:00Z",
  "records": [
    {
      "id": "pet_airline_001",
      "airline_name_en": "Japan Airlines",
      "airline_name_ja": "日本航空(JAL)",
      "official_url": "https://www.jal.co.jp/jp/en/inter/support/pet/",
      "source_language": "en",
      "pet_type": ["dog", "cat"],
      "cabin_allowed": "no",
      "checked_baggage_allowed": "yes",
      "cargo_allowed": "yes",
      "brachycephalic_restriction": {
        "applies": "yes",
        "details_en": "French Bulldogs and Bulldogs not accepted.",
        "details_ja": "フレンチブルドッグおよびブルドッグは受託不可"
      },
      "weight_limit": {
        "value": null,
        "unit": "kg",
        "scope": "unknown",
        "notes_en": "Page does not publish a weight cap; rental crate sizes are listed but no weight limit is given.",
        "notes_ja": "公式ページに重量上限の記載なし。レンタルクレートのサイズのみ掲載"
      },
      "carrier_size_limit": {
        "length_cm": null,
        "width_cm": null,
        "height_cm": null,
        "sum_cm": null,
        "notes_en": "IATA-compliant crate required; must allow standing, lying, turning. Rental crate sizes available: L 45 x 45 x 41 cm, M 32 x 32 x 39 cm.",
        "notes_ja": "IATA基準クレート必須。立つ・横たわる・向きを変えるが可能であること。レンタルクレートサイズ: L 45×45×41 cm、M 32×32×39 cm"
      },
      "reservation_method_en": "Advance reservation via JAL Contact Center; provide crate size, total weight, pet type, and age.",
      "reservation_method_ja": "JALコンタクトセンターで事前予約。クレートサイズ、総重量、種類・年齢を申告",
      "required_documents_en": [
        "Import/export documents required by destination and transit countries",
        "Airport forms",
        "CDC check for dogs to the US",
        "Consent letter"
      ],
      "required_documents_ja": [
        "輸出入国の検疫書類",
        "空港での書類署名",
        "米国向け犬はCDC確認",
        "同意書"
      ],
      "fee_info_en": "Applicable charges provided at check-in; exact fee not published on the page.",
      "fee_info_ja": "チェックイン時に適用料金案内。公式ページ上の具体額は不明",
      "notes_en": "Dogs and cats must be at least 8 weeks old; pregnant pets not accepted; check in at least 120 minutes before departure.",
      "notes_ja": "犬猫は生後8週以上。妊娠中不可。出発120分前までのチェックイン推奨",
      "last_checked_at": "2026-04-27",
      "confidence": "high"
    },
    {
      "id": "pet_airline_002",
      "airline_name_en": "All Nippon Airways",
      "airline_name_ja": "全日本空輸(ANA)",
      "official_url": "https://www.ana.co.jp/en/us/travel-information/pet-policy/",
      "source_language": "en",
      "pet_type": ["dog", "cat", "small_mammal"],
      "cabin_allowed": "no",
      "checked_baggage_allowed": "yes",
      "cargo_allowed": "conditional",
      "brachycephalic_restriction": {
        "applies": "conditional",
        "details_en": "Short-nosed dog breeds not accepted between 2026-05-01 and 2026-10-31 each year (annually recurring seasonal embargo; verify yearly).",
        "details_ja": "短頭種犬は毎年5月1日(2026-05-01)から10月31日(2026-10-31)まで受託不可。年次の季節制限のため毎年要確認"
      },
      "weight_limit": {
        "value": 45,
        "unit": "kg",
        "scope": "pet_plus_carrier",
        "notes_en": "Maximum pet+cage 45 kg.",
        "notes_ja": "ペット+ケージ最大45 kg"
      },
      "carrier_size_limit": {
        "length_cm": null,
        "width_cm": null,
        "height_cm": null,
        "sum_cm": 292,
        "notes_en": "IATA-compliant cage. Must allow standing, sitting, sleeping, turning. Maximum sum-of-3-sides 292 cm.",
        "notes_ja": "IATA基準ケージ。立つ・座る・眠る・向きを変えるが可能であること。3辺合計292cm以下"
      },
      "reservation_method_en": "Phone reservation only; ANA-operated flights only.",
      "reservation_method_ja": "電話予約のみ。ANA運航便のみ",
      "required_documents_en": [
        "Export quarantine certificate",
        "Health certificate",
        "Import certificate may be required",
        "Japan import notification for dogs/cats at least 40 days before arrival"
      ],
      "required_documents_ja": [
        "輸出検疫証明書",
        "健康証明書",
        "輸入証明書(必要時)",
        "日本輸入時は犬猫の40日前届出"
      ],
      "fee_info_en": "International across areas: JPY 40000 / USD 400 / CAD 400 / EUR 300. Within an area: JPY 25000 / USD 250 / CAD 250 / EUR 200. Domestic: separate fee structure.",
      "fee_info_ja": "国際線エリア跨ぎ: JPY 40,000 / USD 400 / CAD 400 / EUR 300。同一エリア: JPY 25,000 / USD 250 / CAD 250 / EUR 200。国内線は別料金",
      "notes_en": "UK, Hong Kong, and Australia may require routing via a cargo agent rather than airport checked-pet handling.",
      "notes_ja": "英国・香港・豪州などは空港受託ではなく貨物代理店対応が必要な場合あり",
      "last_checked_at": "2026-04-27",
      "confidence": "high"
    },
    {
      "id": "pet_airline_003",
      "airline_name_en": "ZIPAIR",
      "airline_name_ja": "ジップエア",
      "official_url": "https://www.zipair.net/en/faq/animal/bringingAnimalsOnBoard",
      "source_language": "multi",
      "pet_type": ["dog", "cat"],
      "cabin_allowed": "no",
      "checked_baggage_allowed": "no",
      "cargo_allowed": "unknown",
      "brachycephalic_restriction": {
        "applies": "unknown",
        "details_en": "unknown",
        "details_ja": "unknown"
      },
      "weight_limit": {
        "value": null,
        "unit": "kg",
        "scope": "unknown",
        "notes_en": "unknown",
        "notes_ja": "unknown"
      },
      "carrier_size_limit": {
        "length_cm": null,
        "width_cm": null,
        "height_cm": null,
        "sum_cm": null,
        "notes_en": "unknown",
        "notes_ja": "unknown"
      },
      "reservation_method_en": "General pets not accepted in cabin or as checked baggage. Service dogs only, by request at booking.",
      "reservation_method_ja": "一般のペットは客室・受託手荷物いずれも不可。補助犬のみ予約時に申告",
      "required_documents_en": [
        "Unknown for general pets",
        "Service dog documentation may be required"
      ],
      "required_documents_ja": [
        "一般のペットは不明",
        "補助犬は所定書類が必要な場合あり"
      ],
      "fee_info_en": "Not applicable (general pets not transported).",
      "fee_info_ja": "対象外(一般のペット輸送は行っていない)",
      "notes_en": "Service dogs (guide dogs, assistance dogs, hearing dogs) may be carried in cabin free of charge.",
      "notes_ja": "盲導犬・介助犬・聴導犬等の補助犬は無料で客室同伴可",
      "last_checked_at": "2026-04-27",
      "confidence": "medium"
    },
    {
      "id": "pet_airline_004",
      "airline_name_en": "Korean Air",
      "airline_name_ja": "大韓航空",
      "official_url": "https://www.koreanair.com/contents/plan-your-travel/special-assistance/travel-with-pets?hl=en",
      "source_language": "multi",
      "pet_type": ["dog", "cat", "bird"],
      "cabin_allowed": "yes",
      "checked_baggage_allowed": "yes",
      "cargo_allowed": "yes",
      "brachycephalic_restriction": {
        "applies": "yes",
        "details_en": "Brachycephalic dogs and cats cannot be accepted as cargo.",
        "details_ja": "短頭種の犬・猫は貨物としての受託不可"
      },
      "weight_limit": {
        "value": 7,
        "unit": "kg",
        "scope": "pet_plus_carrier",
        "notes_en": "Cabin: pet+carrier up to 7 kg. Cargo fee table has bands of under 32 kg and 33-45 kg, indicating cargo allows up to 45 kg.",
        "notes_ja": "機内: ペット+キャリア7kgまで。貨物室の料金は32kg以下と33-45kgの帯があり、貨物室は最大45kgまで"
      },
      "carrier_size_limit": {
        "length_cm": 45,
        "width_cm": 32,
        "height_cm": 19,
        "sum_cm": null,
        "notes_en": "Cabin carrier: 32 cm W x 45 cm D x 19 cm H. Soft carriers up to 25 cm height if compressible to 19 cm.",
        "notes_ja": "機内キャリア: 32cm幅×45cm奥行×19cm高さ。ソフトキャリアは19cmに圧縮可能なら25cm高まで可"
      },
      "reservation_method_en": "Request pet travel service in advance via Korean Air website or Service Center; international reservation at least 48 hours before flight.",
      "reservation_method_ja": "Webまたはサービスセンターで事前申請。国際線は出発48時間前まで",
      "required_documents_en": [
        "Country-specific documents required (varies by destination)",
        "Details unknown from accessible official text"
      ],
      "required_documents_ja": [
        "国・地域別書類が必要",
        "詳細は渡航先条件に依存"
      ],
      "fee_info_en": "Service fees shown by route and weight; e.g., per cage under 32 kg and 33-45 kg bands.",
      "fee_info_ja": "路線・重量帯別。32kg以下、33-45kgの料金帯あり",
      "notes_en": "Dogs, cats, and pet birds: 8 weeks+ can travel in cabin; 16 weeks+ can be transported in the cargo hold.",
      "notes_ja": "犬・猫・ペット鳥。機内は生後8週以上、貨物室は生後16週以上",
      "last_checked_at": "2026-04-27",
      "confidence": "medium"
    },
    {
      "id": "pet_airline_005",
      "airline_name_en": "Asiana Airlines",
      "airline_name_ja": "アシアナ航空",
      "official_url": "https://flyasiana.com/C/KR/EN/contents/traveling-with-pets",
      "source_language": "en",
      "pet_type": ["dog", "cat", "bird"],
      "cabin_allowed": "yes",
      "checked_baggage_allowed": "yes",
      "cargo_allowed": "unknown",
      "brachycephalic_restriction": {
        "applies": "yes",
        "details_en": "Checked-in transport of short-nosed animals discontinued. Listed short-nosed dogs and cats are restricted.",
        "details_ja": "短頭種動物の受託手荷物による輸送は廃止。指定の短頭種の犬・猫は制限あり"
      },
      "weight_limit": {
        "value": 7,
        "unit": "kg",
        "scope": "pet_plus_carrier",
        "notes_en": "Cabin: pet+cage up to 7 kg. Checked baggage: pet+cage up to 45 kg.",
        "notes_ja": "機内: ペット+ケージ7kgまで。受託手荷物: ペット+ケージ45kgまで"
      },
      "carrier_size_limit": {
        "length_cm": 45,
        "width_cm": 32,
        "height_cm": 21,
        "sum_cm": null,
        "notes_en": "Cabin hard cage max L 45 x W 32 x H 21 cm. Soft cage up to H 26 cm if compressible to H 21 cm. Checked baggage: max sum-of-3-sides 285 cm and max height 84 cm.",
        "notes_ja": "機内ハードケージ最大L45×W32×H21cm。ソフトケージはH21cmに圧縮可能ならH26cmまで可。受託手荷物は3辺合計285cm以下、高さ84cm以下"
      },